id,category,product_url,name,ingredients
1,Makeup_remover,https://www.ewg.org/skindeep/products/964612-Be_Natural_Organics_Micellar_Cleansing_Water/,Be Natural Organics Micellar Cleansing Water,"Aqua, Helichrysum italicum floral water, propanediol, sodium lactate, sorbitan oleate decylglucoside crosspolymer, benzyl alcohol, salicylic acid, glycerin, sorbic acid, glycerin, laminaria (algae) extract, glycerin, cucumis sativus (cucumber) fruit extract, glycerin, water, crithmum maritimum (sea fennel) extract, glycerin, laminaria digitata (sea kelp) extract."
2,Makeup_remover,https://www.ewg.org/skindeep/products/1086088-Three_Ships_Nourish_Lavender__MCT_Cleansing_Oil/,Three Ships Nourish Lavender + MCT Cleansing Oil,"Caprylic/Capric Trigylceride (Fractionated Coconut Oil), Pelargonium Graveolens (Geranium) Flower Oil, Lavandula Angustifolia (Lavender) Oil, Linalool, Geraniol, Citronellol"
3,Makeup_remover,https://www.ewg.org/skindeep/products/932870-WO_Remove_/,W/O Remove,"Hamamelis Virginiana Extract (Witch Hazel)* , Cold Pressed Virgin Unrefined Vitis vinifera Oil (Grapeseed Oil)*"
4,Makeup_remover,https://www.ewg.org/skindeep/products/7169239-Rejuva_Minerals_Cranberry_Fruit_Makeup_Remover_Pads/,Rejuva Minerals Cranberry Fruit Makeup Remover Pads,"*Vaccinium Macrocarpon (Cranberry) Fruit Extract, Aqua (Water), *Glycerin, Coconut Oil Glycereth-8 Esters, Leuconostoc/Radish Root Ferment Filtrate, 1,2-Hexanediol, Caprylyl Glycol, Sodium Gluconate, Tropolone, Citric Acid, Sodium Hydroxide"
5,Makeup_remover,https://www.ewg.org/skindeep/products/805214-Doctor_Butlers_Organic_Soothing_Wipes/,Doctor Butler's Organic Soothing Wipes,"Organic Bamboo Cloth, Filtered Water, Vitamin E (Non-Synthetic Tocopherols), Rosemary Oil Extract, Lysine, Calendula Officinalis, Chamomilia Recutita, Sodium Citrate, Betaine"
6,Makeup_remover,https://www.ewg.org/skindeep/products/671073-Be_Green_Bath__Body_Makeup_Remover/,Be Green Bath & Body Makeup Remover,"Vitis Vinifera (Grape) Seed Oil, Europaea (Olive) Oil*, Ricinus Communis (Castor) Oil*, Lavandula Angustifolia (Lavender) Oil*, Citrus Nobilis (Mandarin Orange) Peel Oil."
7,Makeup_remover,https://www.ewg.org/skindeep/products/703335-Organic_to_Green_Coco_Oil_Liquid_Coconut_Oil_Lemon/,"Organic to Green Coco Oil Liquid Coconut Oil, Lemon","Caprylic/Capric Triglyceride (coconut Fractionated), Cocos Nucifera (Organic Coconut Virgin) Oil*, Citrus Medica Limonum (Lemon) Peel Oil*, Rubus Ideaus (Red Raspberry) Seed Oil*, Salvia Officinalis (Sage) Extract Oil*, Arctium Lappa (Burdock) Root Extract*, Tocopheryl Acetate (Vitamin E). *Certified Organic (USDA or Ecocert)"
8,Makeup_remover,https://www.ewg.org/skindeep/products/663958-Qet_Botanicals_Eye_Makeup_Remover/,Qet Botanicals Eye Makeup Remover,"Carthamus Tinctorius (Safflower) Seed Oil*, Vitis Vinifera (Grape) Seed Oil*, Vaccinium Macrocarpon (Cranberry) Seed Oil, Lavandula Angustifolia (Lavender) Flower Oil*, Tocopherol (Non-GMO Vitamin E). *Organic Ingredient"
9,Makeup_remover,https://www.ewg.org/skindeep/products/710964-Vikas_Essentials_Makeup_Remover/,Vika's Essentials Makeup Remover,"Apricot Kernel Oil (Prunus armeniaca)*, Sweet Almond Oil (Prunus amygdalus dulcis)*, Virgin Coconut Oil (Cocos nucifera)*"
10,Makeup_remover,https://www.ewg.org/skindeep/products/707405-Whamisa_Organic_Flowers_Cleansing_Oil/,Whamisa Organic Flowers Cleansing Oil,"*Corylus Avellana (Hazel) Seed Oil, **Caprylic/Capric Triglyceride, *Olea Europaea (Olive) Fruit Oil, *Persea Gratissima (Avocado) Oil, *Camellia Japonica Seed Oil, *Argania Spinosa Kernel Oil, *Simmondsia Chinensis (Jojoba) Seed Oil, ***Scutellaria Baicalensis Root Extract, ***Paeonia Suffruticosa Root Extract, ***Glycyrrhiza Glabra (Licorice) Root Extract, *Lactobacillus/Chrysanthemum Sinense Flower Ferment Filtrate, *Lactobacillus/Nelumbo Nucifera Flower Ferment Filtrate, *Lactobacillus/Taraxacum Officinate (Dandelion) Rhizome/Root Ferment Filtrate, Aniba Rosaeodora (Rosewood) Wood Oil, Citrus Aurantium Bergamia (Bergamot) Fruit Oil, Geranium Maculatum Oil, p-Methoxybenzaldehyde, Hexyl acetate, Vanillin, Phenylacetic acid, gamma-Undecalactone."
11,Makeup_remover,https://www.ewg.org/skindeep/products/994541-True_Botanicals__True_Botanicals_Calm_Ginger_Turmeric_Cleansing_Balm/,True Botanicals Calm Ginger Turmeric Cleansing Balm,"helianthus annuus (sunflower) seed oil*, hydrogenated vegetable oil, polyglyceryl-4 oleate, persea gratissima (avocado) oil, hydrogenated jojoba oil, cetearyl olivate, sorbitan olivate, citrus reticulata (tangerine) peel oil*, argania spinosa (argan) kernel oil*, avena sativa (oat) kernel oil, cucumis sativus (cucumber) oil*, zingiber officinale (ginger) root oil*, vaccinium myrtillus fruit/leaf extract, curcuma longa (turmeric) root extract, saccharum officinarum (sugarcane) extract, citrus aurantium dulcis (orange) fruit extract, citrus limon (lemon) fruit extract, acer saccharum (sugar maple) extract, yucca schidigera extract, tocopherol, citrus aurantium (neroli) oil, azelaic acid, lactic acid, phosphoric acid, sodium benzoate, aqua/water/eau, limonene, geraniol, linalool."
12,Makeup_remover,https://www.ewg.org/skindeep/products/703333-Organic_to_Green_Coco_Oil_Liquid_Coconut_Oil_Rose/,"Organic to Green Coco Oil Liquid Coconut Oil, Rose","Caprylic/Capric Triglyceride (coconut Fractionated), Cocos Nucifera (Organic Coconut Virgin) Oil*, Rosa Otto Damascena (Rose) Essential Oil*, Aniba Rosaeodora (Rosewood) Wood Oil*, Rosa Mosqueta (Rosehip) Fruit Oil*, Leontopodium Alpinum (Edelweiss) Extract*, L-Ascorbic Acid (Vitamin C), Tocopheryl Acetate (Vitamin E). *Certified Organic (USDA or Ecocert)"
13,Makeup_remover,https://www.ewg.org/skindeep/products/714125-Planted_in_Beauty_PURIFY__CONDITION_MAKEUP_REMOVER/,Planted in Beauty PURIFY + CONDITION MAKEUP REMOVER,"Aloe Barbadensis (Aloe Vera) Leaf Juice, Glycerin, Citrus Aurantium Dulcis (Orange) Fruit Water, Water, Polyglyceryl-4 Caprate, Decyl Glucoside, Lycium Chinense Fruit Extract, Morus Alba Root Extract, Carica Papaya (Papaya) Fruit Extract, Gaultheria Procumbens (Wintergreen) Leaf Extract, Sodium PCA, Sucrose Laurate, Levulinic Acid, Sodium Hydroxide, P-Anisic Acid, Sodium Levulinate, Amyris Balsamifera Bark Oil, Phytic Acid, Linalool, Citronellol"
14,Makeup_remover,https://www.ewg.org/skindeep/products/1076858-Crunchi_I_AM_The_Balm_Makeup_Cleansing_Balm/,CRUNCHI I AM The Balm Makeup Cleansing Balm,"Prunus Amygdalus Dulcis (Sweet Almond) Oil, Olive Oil Polyglyceryl-6 Esters, Candelilla Cera, Copernicia Cerifera (Carnauba) Wax, Polyglyceryl-4 Caprylate, Squalane, Opuntia Ficus-Indica (Prickly Pear) Seed Oil*, Citrus Paradisi (Grapefruit) Peel Oil, Tocopherol, Curcuma Longa (Turmeric) Root Extract*, Zingiber Officinale (Ginger) Root Oil"
15,Makeup_remover,https://www.ewg.org/skindeep/products/701907-Exactly_Organics_Eye_Makeup_and_Mascara_Remover/,Exactly! Organics Eye Makeup and Mascara Remover,"Helianthus Annuus (Sunflower) Oil*, Simmondsia Chinensis (Jojoba)*, Argania Spinsosa (Argan) Oil*, Organic Rosa Rubiginosa (Rose Hip) Oil*, *Certified Organic"
16,Makeup_remover,https://www.ewg.org/skindeep/products/1086093-Busy_Co__Busy_Co_Glow_Face_Wipes_Brightening_Lavender/,"Busy Co. Glow Face Wipes, Brightening Lavender","Water (Aqua), Phenoxyethanol, Heptyl Glucoside, Sodium Benzoate, Potassium Sorbate, Ethylhexylglycerin, Ascorbyl Glucoside, Sodium Hyaluronate, Ethylhexyl Olivate, Sodium Acrylates Copolymer, Polyglyceryl-4 Oleate, Anthemis Nobilis Flower Oil, Amyris Balsamifera Bark Oil, Boswellia Carterii Oil, Cannabis Sativa Seed/Stem Oil, Lavandula Angustifolia (Lavender) Oil, Pelargonium Graveolens Flower Oil, Pogostemon Cablin Oil, Rose Flower Oil, Salvia Sclarea (Clary) Oil, Glycerin, Panthenol, Cocos Nucifera (Coconut) Fruit Extract, Aloe Barbadensis Leaf Juice"
17,Makeup_remover,https://www.ewg.org/skindeep/products/1022122-Dore_La_Micellaire/,Dore La Micellaire,"AQUA (WATER/EAU), GLYCERIN, CENTAUREA CYANUS FLOWER WATER, XYLITYLGLUCOSIDE, LEVULINIC ACID, SODIUM BENZOATE, ANDROXYLITOL, SODIUM LEVULINATE, XYLITOL, ROSA DAMASCENA FLOWER WATER, SODIUM HYDROXIDE, CAPRYLYL/CAPRYL GLUCOSIDE, ALOE BARBADENSIS LEAF EXTRACT, CITRIC ACID, POTASSIUM SORBATE"
18,Makeup_remover,https://www.ewg.org/skindeep/products/703334-Organic_to_Green_Coco_Oil_Liquid_Coconut_Oil_Ginger/,"Organic to Green Coco Oil Liquid Coconut Oil, Ginger","Caprylic/Capric Triglyceride (coconut Fractionated), Cocos Nucifera (Organic Coconut Virgin) Oil*, Zingiber Officinale (Ginger) Essential Oil*, Annona Cherimola (Cherimoya) Extract*, Aloe Barbadensis Leaf (Aloe Vera) Extract*, Hippophae Rhamnoides (Sea Buckthorn) Fruit Oil*, Tocopheryl Acetate (Vitamin E). *Certified Organic (USDA or Ecocert)"
19,Makeup_remover,https://www.ewg.org/skindeep/products/5341676-Bambu_Earth_Dirt__Makeup_Cleansing_Oil/,Bambu Earth Dirt & Makeup Cleansing Oil,"HELIANTHUS ANNUUS (SUNFLOWER) SEED OIL, CARTHAMUS TINCTORIUS (SAFFLOWER) SEED OIL, CALOPHYLLUM INOPHYLLUM OIL, BOSWELLIA CARTERI OIL, PELARGONIUM GRAVEOLENS OIL"
20,Makeup_remover,https://www.ewg.org/skindeep/products/1013698-Honest_Beauty_Makeup_Remover_Wipes/,Honest Beauty Makeup Remover Wipes,"Water, Propanediol, Isopropyl palmitate, Glycolipids, Hydroxyacetophenone, Glyceryl Citrate/Lactate/Linoleate/Oleate, 1,2-Hexanediol, Caprylyl Glycol, Polyglyceryl-4 Cocoate, Polyglyceryl-3 Caprate, Glyceryl Caprylate, Trisodium Ethylenediamine Disuccinate, Sodium Citrate"
21,Makeup_remover,https://www.ewg.org/skindeep/products/1063334-natracare_Cleansing_Makeup_Removal_Wipes/,Natracare Cleansing Makeup Removal Wipes,"Aqua, Aloe Barbadensis Leaf Water *, Sodium Citrate, Glycerin, Gluconolactone, Brassica Campestris Seed Oil, Chamomilla Recutita Flower Water *, Prunus Armeniaca Kernel Oil *, Helianthus Annuus (Sunflower) Seed Oil, Avena Strigosa Seed Extract, Lauryl Glucoside, Tocopherol, Polyglyceryl-2-Dipolyhydroxystearate, Polyglyceryl-4-Caprate, Parfum [Citrus Aurantium Dulcis (Orange Oil), Lavandula Hybrida Oil, Citrus Nobilis (Mandarin Orange) Peel Oil, Citrus Medica Limonum (Lemon) Peel Oil, Lavandula Angustifolia Oil, Citrus Aurantium Amara Extract], Sodium Benzoate, Levulinic Acid, Calcium Gluconate, Potassium Sorbate, Sodium Levulinate, Glyceryl Oleate, Dicaprylyl Carbonate, Citric Acid, Lecithin, Sodium Phytate, Limonene **, Linalool **"
22,Makeup_remover,https://www.ewg.org/skindeep/products/1416428-cleanjourney_Slick_Goodbye_Makeup_Removing_Cleansing_Oil/,cleanjourney Slick Goodbye Makeup Removing Cleansing Oil,"Caprylic/Capric Triglyceride, Vitis Vinifera (Grape) Seed Oil, Sorbeth-30 Tetraoleate, Prunus Amygdalus Dulcis (Sweet Almond) Oil, Ricinus Communis (Castor) Seed Oil, Helianthus Annuus (Sunflower) Seed Oil, Tocopherol"
23,Makeup_remover,https://www.ewg.org/skindeep/products/703336-Organic_to_Green_Coco_Oil_Liquid_Coconut_Oil_Vanilla_Chamomile/,"Organic to Green Coco Oil Liquid Coconut Oil, Vanilla Chamomile","Caprylic/Capric Triglyceride (coconut Fractionated), Cocos Nucifera (Organic Coconut Virgin) Oil*, Vanilla Tahitensis Fruit (Vanilla) Oil*, Anthemis Nobilis Flower (Roman Chamomile) Oil*, Aloe Barbadensis Leaf (Aloe Vera) Extract*, Calendula Officinalis (Calendula) Flower Extract*, Marrubium Vulgare (Marrubium) Extract*, Tocopheryl Acetate (Vitamin E). *Certified Organic (USDA or Ecocert)"
24,Makeup_remover,https://www.ewg.org/skindeep/products/1029866-Ardell_Professional_Lash_Remover/,Ardell Professional Lash Remover,ETHOXYDIGLYCOL
25,Makeup_remover,https://www.ewg.org/skindeep/products/9106264-Ben_Nye_RemoveIt_All/,Ben Nye Remove-It All,ISOPROPYL MYRISTATE
26,Makeup_remover,https://www.ewg.org/skindeep/products/861255-Clinique_Take_the_Day_Off_Cleansing_Balm_2020_formulation/,Clinique Take the Day Off Cleansing Balm (2020 formulation),"ETHYLHEXYL PALMITATE, CARTHAMUS TINCTORIUS (SAFFLOWER) SEED OIL, CAPRYLIC/CAPRIC TRIGLYCERIDE, SORBETH-30 TETRAOLEATE, POLYETHYLENE, PEG-5 GLYCERYL TRIISOSTEARATE, WATERAQUAEAU, TOCOPHEROL, PHENOXYETHANOL [ILN30654]"
27,Makeup_remover,https://www.ewg.org/skindeep/products/6638597-Glamnetic_Lash_Extension_Bond_Remover/,Glamnetic Lash Extension Bond Remover,"Water (Aqua/Eau), Propylene Glycol, Cocos Nucifera (Coconut) Oil, PEG-6, Phenoxyethanol."
28,Makeup_remover,https://www.ewg.org/skindeep/products/965725-Clinique_Take_the_Day_Off_Cleansing_Balm/,Clinique Take the Day Off Cleansing Balm,"ETHYLHEXYL PALMITATE, CARTHAMUS TINCTORIUS (SAFFLOWER) SEED OIL, CAPRYLIC/CAPRIC TRIGLYCERIDE, SORBETH-30 TETRAOLEATE, POLYETHYLENE, PEG-5 GLYCERYL TRIISOSTEARATE, WATER AQUAEAU, TOCOPHEROL, PHENOXYETHANOL [ILN30654]"
29,Makeup_remover,https://www.ewg.org/skindeep/products/1054635-rms_beauty_Raw_Coconut_Cream/,RMS Beauty Raw Coconut Cream,Cocos Nucifera (Coconut) Oil
30,Makeup_remover,https://www.ewg.org/skindeep/products/1020408-Garnier_Skinactive_Micellar_Cleansing_Water/,"We're sorry, but something went wrong.",Bilinmeyen Bileşenler
31,Makeup_remover,https://www.ewg.org/skindeep/products/823142-Honey_Girl_Organics_Facial_Cleanser__Makeup_Remover__2019_formulation/,Honey Girl Organics Facial Cleanser & Makeup Remover  (2019 formulation),"Purified Water, Organic Extra Virgin Olive Oil, Organic Beeswax, Organic Lemon Oil (Citrus limon)"
32,Makeup_remover,https://www.ewg.org/skindeep/products/1028606-Butter_Me_Up_Organics_Organic_Makeup_Remover/,Butter Me Up Organics Organic Makeup Remover,"Aloe*, Witch Hazel*, Saponified Castor Oil*, Olive Oil*, Sunflower Oil*, Coconut Oil*, Citric Acid*, Rosemary Extract*, Water"
33,Makeup_remover,https://www.ewg.org/skindeep/products/916020-Signature_Care_Micellar_Cleansing_Water_2019_formulation/,Signature Care Micellar Cleansing Water (2019 formulation),": WATER, HEXYLENE GLYCOL, POLOXAMER 184, GLYCERIN, POLYAMINOPROPYL BIGUANIDE, DISODIUM COCOAMPHODIACETATE, DISODIUM EDTA."
34,Makeup_remover,https://www.ewg.org/skindeep/products/4366658-RevitaLash_Cosmetics_Micellar_Water_Lash_Wash/,Revitalash Cosmetics Micellar Water Lash Wash,"Aqua/Water/Eau, Hexylene Glycol, Glycerin, Aloe Barbadensis Leaf Juice, Chamomilla Recutita Flower Water, Disodium Cocoamphodiacetate, Hydroxyacetophenone, Polyglycerin-4, Polyglycerin-6, 1,2-Hexanediol, Caprylyl Glycol, Panthenol, Sodium Chloride, Citric Acid, Potassium Sorbate, Sodium Benzoate."
35,Makeup_remover,https://www.ewg.org/skindeep/products/996260-Plant_Therapy_Hydrosol_Rosemary/,"Plant Therapy Hydrosol, Rosemary","Rosmarinus Officinalis (Rosemary) Water*, Aqua (Water), p-Anisic Acid, Polylysine, Glycerin, Lactic Acid"
36,Makeup_remover,https://www.ewg.org/skindeep/products/933093-Moor_Spa_Makeup_Remover_2020_formulation/,Moor Spa Make-up Remover (2020 formulation),"Aqua, Helianthus Annuus (Sunflower) Seed Oil, Olea Europaea (Olive) Fruit Oil, Propanediol, Oleic Acid, Heilmoor Clay, Caprylyl Glycol, Rosmarinus Officinalis (Rosemary) Leaf Extract, Citric Acid, Sodium Citrate"
37,Makeup_remover,https://www.ewg.org/skindeep/products/9096927-Skin_Proud_Face_Melt_Gentle_Hydrating_Cleansing_Balm_and_Makeup_Remover_All_Skin_Types/,"Skin Proud Face Melt Gentle Hydrating Cleansing Balm and Makeup Remover, All Skin Types","Ethylhexyl Palmitate, Helianthus Annuus (Sunflower) Seed Oil, PEG-20 Glyceryl Triisostearate, Synthetic Wax (Cire Synthetique), Butyrospermum Parkii (Shea) Butter, Caprylyl Glycol, Cocos Nucifera (Coconut) Oil, Tocopheryl Acetate, Argania Spinosa Kernel Oil, Olea Europaea (Olive) Fruit Oil, Oryza Sativa (Rice) Bran Oil, Rosa Canina Fruit Oil, Citrus Aurantium Bergamia (Bergamot) Fruit Oil, Ceramide NP, Trihydroxystearin, Sodium Hyaluronate, Limonene, Linalool."
38,Makeup_remover,https://www.ewg.org/skindeep/products/867635-Garnier_SkinActive_Allin1_Rinse_Off_Micellar_Foaming_Cleanser_for_All_Skin_Types_2019_formulation/,Garnier SkinActive All-in-1 Rinse Off Micellar Foaming Cleanser for All Skin Types (2019 formulation),"967071 29 AQUA/WATER, GLYCERIN, PEG-200 HYDROGENATED GLYCERYL PALMATE, COCO-BETAINE, SODIUM LAURETH SULFATE, POLYSORBATE 20, PEG-7 GLYCERYL COCOATE, CITRIC ACID, COCAMIDE MEA, PEG-55 PROPYLENE GLYCOL OLEATE, POLYQUATERNIUM-11, PPG-5 CETETH-20, PROPYLENE GLYCOL, SODIUM BENZOATE, SODIUM CHLORIDE, SODIUM HYDROXIDE, VITIS VINIFERA FRUIT WATER/GRAPE FRUIT WATER."
39,Makeup_remover,https://www.ewg.org/skindeep/products/883811-Etos_Reusable_Make_Up_Remover_Cloth_2018_formulation/,Etos Reusable Make Up Remover Cloth (2018 formulation),100% POLYESTER.
40,Makeup_remover,https://www.ewg.org/skindeep/products/996257-Plant_Therapy_Hydrosol_Roman_Chamomile/,"Plant Therapy Hydrosol, Roman Chamomile","Anthemis Nobilis (Roman Chamomile) Flower Water*, Leuconostoc/Radish Root Ferment Filtrate, Aqua (Water)"
41,Makeup_remover,https://www.ewg.org/skindeep/products/870822-Neutrogena_Deep_Clean_Purifying_Micellar_Cleansing_Water_2019_formulation/,Neutrogena Deep Clean Purifying Micellar Cleansing Water (2019 formulation),"WATER, PEG-6 CAPRYLIC/CAPRIC GLYCERIDES, POLYSORBATE 20, BUTYLENE GLYCOL, PEG-8, POLOXAMER 407, CITRIC ACID, SODIUM BENZOATE, DISODIUM EDTA, PORTULACA OLERACEA EXTRACT"
42,Makeup_remover,https://www.ewg.org/skindeep/products/584322-Aleavia_Cleanse/,Aleavia Cleanse,"Water, Coconut Oil, Aloe, Sea Salt, Kelp, Citric Acid, Glycerin (Plant Derived)"
43,Makeup_remover,https://www.ewg.org/skindeep/products/873587-Garnier_SkinActive_Allin1_Micellar_Cleansing_Water_2019_formulation/,Garnier SkinActive All-in-1 Micellar Cleansing Water (2019 formulation),"WATER, HEXYLENE GLYCOL, GLYCERIN, DISODIUM COCOAMPHODIACETATE, DISODIUM EDTA, POLOXAMER 184, POLYAMINOPROPYL BIGUANIDE."
44,Makeup_remover,https://www.ewg.org/skindeep/products/7263265-Swiss_Toniq_MakeUp_Remover_Cleansing_Bar/,Swiss Toniq Make-Up Remover Cleansing Bar,"Butyrospermum Parkii Butter, Cocos Nucifera Oil, Aqua, Mangifera Indica Seed Butter, Ricinus Communis Seed Oil, Argania Spinosa Kernel Oil, Theobroma Cacao Seed Butter, Rosa Canina Fruit Oil, Olea Europaea Fruit Oil, Rosmarinus Officinalis Leaf Extract, Helianthus Annuus Seed Oil, Prunus Amygdalus Dulcis Oil, Vitis Vinifera Seed Oil"
45,Makeup_remover,https://www.ewg.org/skindeep/products/927717-LOral_Paris_Loreal_Paris_Micellar_Cleansing_Water_2020_formulation/,L'oreal Paris Micellar Cleansing Water (2020 formulation),"AQUA/WATER, HEXYLENE GLYCOL, POLOXAMER 184, DISODIUM COCOAMPHODIACETATE, DISODIUM EDTA, POLYAMINOPROPYL BIGUANIDE"
46,Makeup_remover,https://www.ewg.org/skindeep/products/808153-rms_beauty_The_Ultimate_Makeup_Remover_Wipe_2018_formulation/,RMS Beauty The Ultimate Makeup Remover Wipe (2018 formulation),*Cocos Nucifera (Coconut) Oil
47,Makeup_remover,https://www.ewg.org/skindeep/products/1069779-Glamnetic_Wipe_Off_Makeup_Remover/,"Glamnetic Wipe Off, Makeup Remover","Water (Aqua/​Eau), Glycerin, Sodium Olivate, 1,2-Hexanediol, Sodium Chloride, Sodium Phytate, Ethylhexylglycerin"
48,Makeup_remover,https://www.ewg.org/skindeep/products/996254-Plant_Therapy_Hydrosol_Melissa/,"Plant Therapy Hydrosol, Melissa","Melissa Officinalis Flower/Leaf/Stem Water*, Leuconostoc/Radish Root Ferment Filtrate, Aqua (Water)"
49,Makeup_remover,https://www.ewg.org/skindeep/products/8693720-Zandra_Beauty_Ya_Dig_Make_Up_Remover/,Zandra Beauty Ya Dig Make Up Remover,"Organic Sunflower seed oil, Organic Pumpkin Seed Oil, Organic Borage Seed Oil, Organic Argan Oil, Organic Jojoba Oil."
50,Makeup_remover,https://www.ewg.org/skindeep/products/996258-Plant_Therapy_Hydrosol_Rose/,"Plant Therapy Hydrosol, Rose","Rosa Damascena (Rose) Flower Water*, Leuconostoc/Radish Root Ferment Filtrate, Aqua (Water)"
51,Makeup_remover,https://www.ewg.org/skindeep/products/1013326-Este_Lauder_Estee_Lauder_Gentle_Eye_Makeup_Remover/,Estee Lauder Gentle Eye Makeup Remover,"Water\\Aqua\\Eau, Peg-32, Butylene Glycol, Disodium Cocoamphodiacetate, Peg-6, Disodium Edta, Phenoxyethanol"
52,Makeup_remover,https://www.ewg.org/skindeep/products/1028439-Empiresquid_Organics_EMPIRESQUID_ORGANICS_EYE_MAKEUP_REMOVER/,"EMPIRESQUID ORGANICS, EYE MAKEUP REMOVER","distilled water, almond oil* castile soap* and vitamin e.     *certified organic"
53,Makeup_remover,https://www.ewg.org/skindeep/products/7885276-Avril_Micellar_water_to_reconstitute/,"Avril Micellar water, to reconstitute","MALTODEXTRIN*, XYLITOL, CITRIC ACID, SODIUM BENZOATE, POTASSIUM SORBATE, INULIN, ERYTHRITOL, SODIUM BICARBONATE, COCAMIDOPROPYL BETAINE, SODIUM GLUCONATE, CAMELLIA SINENSIS SEED EXTRACT, DEXTRIN, SODIUM CHLORIDE, AQUA (WATER), ALOE BARBADENSIS LEAF JUICE POWDER*"
54,Makeup_remover,https://www.ewg.org/skindeep/products/873826-Vaseline_100_Pure_Petroleum_Jelly_2019_formulation/,Vaseline 100% Pure Petroleum Jelly (2019 formulation),"Active Ingredients: WHITE PETROLATUM, USP 100.0%; Inactive Ingredients:"
55,Makeup_remover,https://www.ewg.org/skindeep/products/836905-Vapour_Organic_Beauty_Clarity_Organic_Makeup_Remover_2019_formulation/,Vapour Organic Beauty Clarity Organic Makeup Remover (2019 formulation),Organic Helianthus Annuus (Sunflower) Seed Oil  Organic Ricinus Communis (Castor) Seed Oil  Organic Simmondsia Chinensis (Jojoba) Seed Oil  Organic Camellia Oleifera (Camellia) Seed Oil  Organic Borago Officinalis (Borage) Leaf Extract  Organic Helichrysum Arenarium Flower Extract  Organic Equisetum Arvense (Horsetail) Leaf Extract  Organic Rosmarinus Officinalis (Rosemary) Leaf Extract
56,Makeup_remover,https://www.ewg.org/skindeep/products/1049041-Bioderma_Sensibio_Micellar_Cleansing_Oil/,Bioderma Sensibio Micellar Cleansing Oil,"ETHYLHEXYL PALMITATE, BRASSICA CAMPESTRIS (RAPESEED) SEED OIL, POLYGLYCERYL-4 OLEATE, AQUA/WATER/EAU, SODIUM PCA, PROPANEDIOL, CAPRYLIC/CAPRIC TRIGLYCERIDE, BENZOTRIAZOLYL DODECYL P-CRESOL, TOCOPHEROL, HELIANTHUS ANNUUS (SUNFLOWER) SEED OIL, LAMINARIA OCHROLEUCA EXTRACT, STEARYL GLYCYRRHETINATE"
57,Makeup_remover,https://www.ewg.org/skindeep/products/2159721-Drunk_Elephant_Slaai_MakeupMelting_Butter_Cleanser/,Drunk Elephant Slaai Makeup-Melting Butter Cleanser,"Ethylhexyl Palmitate, Caprylic/Capric Triglyceride, Carthamus Tinctorius (Safflower) Seed Oil, Lauryl Laurate, Polyglyceryl-3 Laurate, Polyhydroxystearic Acid, Helianthus Annuus (Sunflower) Seed Wax, Polyglyceryl-10 Laurate, Sclerocarya Birrea Seed Oil, Euterpe Oleracea Fruit Oil, Actinidia Chinensis (Kiwi) Fruit Extract, Fragaria Ananassa (Strawberry) Seed Extract, Vaccinium Macrocarpon (Cranberry) Seed Oil, Borago Officinalis Seed Oil, Adansonia Digitata Seed Oil, Polyglyceryl-2 Caprate, Citrullus Lanatus (Watermelon) Seed Oil, Prunus Amygdalus Dulcis (Sweet Almond) Oil, Schinziophyton Rautanenii Kernel Oil, Vaccinium Angustifolium (Blueberry) Fruit Extract, Ximenia Americana Seed Oil, Tocopherol, Glycerin."
58,Makeup_remover,https://www.ewg.org/skindeep/products/1022261-POPARAZZI_Pop_Arazzi_Makeup_Remover_Wipes_Fragrance_Free/,"Pop Arazzi Makeup Remover Wipes, Fragrance Free","WATER, DICAPRYLYL ETHER, DECYL GLUCOSIDE, GLYCERYL OLEATE, PHENOXYETHANOL, BENZOIC ACID, DEHYDROACETIC ACID, TETRASODIUM GLUTAMATE DIACETATE, CITRIC ACID, SODIUM CITRATE, SODIUM BICARBONATE, TOCOPHERYL ACETATE, PANTHENOL"
59,Makeup_remover,https://www.ewg.org/skindeep/products/1080448-Anita_Grant_Papaya_Oil_/,Anita Grant Papaya Oil,Papaya Oil (Carica papaya)
60,Makeup_remover,https://www.ewg.org/skindeep/products/997698-Drunk_Elephant_Slaai_MakeupMelting_Butter_Cleanser/,Drunk Elephant Slaai Makeup-Melting Butter Cleanser,"Ethylhexyl Palmitate, Caprylic/Capric Triglyceride, Carthamus Tinctorius (Safflower) Seed Oil, Lauryl Laurate, Polyglyceryl-3 Laurate, Polyhydroxystearic Acid, Helianthus Annuus (Sunflower) Seed Wax, Polyglyceryl-10 Laurate, Sclerocarya Birrea Seed Oil, Euterpe Oleracea Fruit Oil, Actinidia Chinensis (Kiwi) Fruit Extract, Fragaria Ananassa (Strawberry) Seed Extract, Vaccinium Macrocarpon (Cranberry) Seed Oil, Borago Officinalis Seed Oil, Adansonia Digitata Seed Oil, Polyglyceryl-2 Caprate, Citrullus Lanatus (Watermelon) Seed Oil, Prunus Amygdalus Dulcis (Sweet Almond) Oil, Schinziophyton Rautanenii Kernel Oil, Vaccinium Angustifolium (Blueberry) Fruit Extract, Ximenia Americana Seed Oil, Tocopherol, Glycerin"
61,Makeup_remover,https://www.ewg.org/skindeep/products/1061474-Ustawi_Nourishing_Cleansing_Balm/,Ustawi Nourishing Cleansing Balm,"Caprylic/Capric Triglyceride, Isopropyl Myristate, Glycerin, C10-18 Triglycerides, Water, Sucrose Laurate, Sucrose Stearate, Silica, Levulinic Acid, Helianthus Annuus (Sunflower) Seed Oil, Tocopherol, Glucosyl Hesperidin, Sodium Levulinate, Ascorbyl Glucoside, Hexylresorcinol, Propanediol, Eucalyptus Globulus Leaf Extract, Adansonia Digitata Fruit Extract, Myrtus Communis Leaf Extract, Sodium Benzoate"
62,Makeup_remover,https://www.ewg.org/skindeep/products/867687-Olay_Luminous_Micellar_Water_2019_formulation/,Olay Luminous Micellar Water (2019 formulation),"WATER, HEXYLENE GLYCOL, GLYCERIN, INOSITOL, ALOE BARBADENSIS LEAF EXTRACT, HAMAMELIS VIRGINIANA (WITCH HAZEL) WATER, NIACINAMIDE, PANTHENOL, PALMITOYL PENTAPEPTIDE-4, CAPRYLYL GLYCOL, 1,2-HEXANEDIOL, PHENOXYETHANOL, CETYL BETAINE, SODIUM BENZOATE, PEG-100, DISODIUM EDTA."
63,Makeup_remover,https://www.ewg.org/skindeep/products/1047132-Corpa_Flora_Beaute_Divine_Cleansing_Oil__Makeup_Remover_Fragrance_Free/,"Corpa Flora Beaute Divine Cleansing Oil & Makeup Remover, Fragrance Free","HELIANTHUS ANNUUS (SUNFLOWER) SEED OIL*, PRUNUS AMYGDALUS DULCIS (SWEET ALMOND) OIL, CAPRYLIC/CAPRIC TRIGLYCERIDE, CAMELLIA SINENSIS (CAMELLIA) SEED OIL*, POLYGLYCERYL-4 OLEATE**, CANNABIS SATIVA (HEMP) SEED OIL, RICINUS COMMUNIS (CASTOR) OIL, ROSA CANINA (ROSEHIP) FRUIT EXTRACT*, ROSMARINUS OFFICINALIS (ROSEMARY) LEAF EXTRACT*"
