id,category,product_url,name,ingredients
408,Makeup_remover,https://www.ewg.org/skindeep/products/1042320-Sephora_Collection_Clean_Cleansing__Gentle_Exfoliating_Wipes_Rose/,"Sephora Collection Clean Cleansing & Gentle Exfoliating Wipes, Rose","Aqua (Water), Glycerin, Polyglyceryl-10 Laurate, Diglycerin, Coco-Glucoside, Butylene Glycol, Levulinic Acid, Parfum (Fragrance), Sodium Benzoate, Sodium Levulinate, Rosa Damascena Flower Extract, Aloe Barbadensis Leaf Juice Powder"
409,Makeup_remover,https://www.ewg.org/skindeep/products/882315-Shea_Moisture_African_Black_Soap_Bamboo_Charcoal_Detoxifying_Micellar_Water_2019_formulation/,"Shea Moisture African Black Soap, Bamboo Charcoal Detoxifying Micellar Water (2019 formulation)","WATER, GLYCERIN (VEGETABLE), SORBITAN OLEATE DECYLGLUCOSIDE CROSSPOLYMER, SODIUM PCA, ROSA CENTIFOLIA FLOWER WATER, PROPANEDIOL, ALOE BARBADENSIS LEAF JUICE, POLYGLYCERYL-10 MYRISTATE, HAMAMELIS VIRGINIANA (WITCH HAZEL) LEAF EXTRACT, CHARCOAL POWDER, SODIUM PALM KERNELATE, SODIUM SHEA BUTTERATE, SODIUM COCOATE, BUTYROSPERMUM PARKII (SHEA) BUTTER*   , THEOBROMA CACAO (COCOA) POD ASH, CAPRYLIC/CAPRIC TRIGLYCERIDE, MELALEUCA ALTERNIFOLIA (TEA TREE) LEAF OIL, AVENA SATIVA (OAT) BRAN EXTRACT, BETA GLUCAN, TAMARINDUS INDICA FRUIT (TAMARIND) EXTRACT, PUNICA GRANATUM (POMEGRANATE) EXTRACT, PLANTAGO MAJOR (PLANTAIN) LEAF EXTRACT, MANGIFERA INDICA (MANGO) SEED OIL, MELIA AZADIRACHTA (NEEM) SEED OIL, TOCOPHEROL, GLUCONOLACTONE, SODIUM BENZOATE, SODIUM PHYTATE, FRAGRANCE (ESSENTIAL OIL BLEND)."
410,Makeup_remover,https://www.ewg.org/skindeep/products/1042376-Sephora_Collection_Waterproof_Eye_Makeup_Remover/,Sephora Collection Waterproof Eye Makeup Remover,"Water, Cyclopentasiloxane, Isohexadecane, Butylene Glycol, Dipotassium Phosphate, Caprylyl Glycol, 1, 2-Hexanediol, Potassium Phosphate, Sodium Chloride, Maltodextrin, Disodium EDTA, Panthenol, Poloxamer 184, Hydroxycetyl Hydroxyethyl Dimonium Chloride, PPG-26-Buteth-26, PEG-40 Hydrogenated Castor Oil, Centaurea Cyanus Flower Extract, CI 61570 (Green 5), CI 42090 (Blue 1 Lake), Apigenin, Oleanolic Acid, Biotinoyl Tripeptide-1, BHT"
411,Makeup_remover,https://www.ewg.org/skindeep/products/870478-Neutrogena_FragranceFree_Makeup_Remover_Cleansing_Towelettes_2019_formulation/,Neutrogena Fragrance-Free Makeup Remover Cleansing Towelettes (2019 formulation),"WATER, CYCLOPENTASILOXANE, PENTAERYTHRITYL TETRAETHYLHEXANOATE, ISOSTEARYL PALMITATE, ISONONYL ISONONANOATE, CETYL ETHYLHEXANOATE, HEXYLENE GLYCOL, ASCORBYL GLUCOSIDE, PANTHENOL, SUCROSE COCOATE, COPPER GLUCONATE, MAGNESIUM ASPARTATE, ZINC GLUCONATE, CARBOMER, COCO-GLUCOSIDE, GLYCERYL OLEATE, PEG-6 CAPRYLIC/CAPRIC GLYCERIDES, ETHYLHEXYLGLYCERIN, IODOPROPYNYL BUTYLCARBAMATE, BENZOIC ACID, DEHYDROACETIC ACID, SODIUM HYDROXIDE, PEG-4 LAURATE, PHENOXYETHANOL"
412,Makeup_remover,https://www.ewg.org/skindeep/products/1042319-Sephora_Collection_Clean_Cleansing__Gentle_Exfoliating_Wipes_Coconut/,"Sephora Collection Clean Cleansing & Gentle Exfoliating Wipes, Coconut","Aqua (Water), Glycerin, Polyglyceryl-10 Laurate, Diglycerin, Coco-Glucoside, Butylene Glycol, Levulinic Acid, Parfum (Fragrance), Sodium Benzoate, Sodium Levulinate, Cocos Nucifera (Coconut) Fruit Extract, Aloe Barbadensis Leaf Juice Powder"
413,Makeup_remover,https://www.ewg.org/skindeep/products/7360177-Flower_Knows_Midsummer_Fairytales_Makeup_Cleansing_Balm/,Flower Knows Midsummer Fairytales Makeup Cleansing Balm,"C15-19 Alkane, Isotridecyl Isononanoate, Cetearyl Ethylhexanoate, Coco-Caprylate/Caprate, Sorbeth-30 Tetraoleate, Synthetic Wax, Peg-7 Glyceryl Cocoate, Hydrogenated Soybean Oil, Peg-3 Glyceryl Isostearate, Caprylic/Capric Triglyceride, Water, Diisostearyl Malate, Citrus Nobilis (Mandarin Orange) Peel Oil, Tocopheryl Acetate, Adansonia Digitata Seed Oil, Butyrospermum Parkii (Shea) Butter, Carthamus Tinctorius (Safflower) Seed Oil, Limnanthes Alba (Meadowfoam) Seed Oil, Simmondsia Chinensis (Jojoba) Seed Oil, Echinacea Purpurea Extract"
414,Makeup_remover,https://www.ewg.org/skindeep/products/876841-Solo_Fragrances_Facial_Cleansing_Wipes_With_Lavender_Oil_Cleanse_and_Nourish_2018_formulation/,"Solo Fragrances Facial Cleansing Wipes With Lavender Oil, Cleanse and Nourish (2018 formulation)","WATER, CETEARYL ISONONANOATE, CETEARETH-20, CETEARYL ALCOHOL, GLYCERYL STEARATE, CETYL PALMITATE, CETEARETH-12, PROPYLENE GLYCOL, CHAMOMILLA RECUTITA (MATRICARIA) FLOWER EXTRACT, LAVANDULA ANGUSTIFOLIA (LAVENDER) OIL, TOCOPHERYL (VITAMIN E) ACETATE, BUTYLENE GLYCOL, SODIUM CITRATE, CITRIC ACID, 2-BROMO-2-NITROPROPANE-1, 3-DIOL, DISODIUM EDTA."
415,Makeup_remover,https://www.ewg.org/skindeep/products/935569-Up__Up_Upup_Evening_Calm_Makeup_Remover_Cleansing_Towelettes_2020_formulation/,Up&up Evening Calm Makeup Remover Cleansing Towelettes (2020 formulation),"WATER, DICAPRYLYL ETHER, DECYL GLUCOSIDE, GLYCERYL OLEATE, PHENOXYETHANOL, BENZOIC ACID, DEHYDROACETIC ACID, TETRASODIUM GLUTAMATE DIACETATE, CITRIC ACID, SODIUM CITRATE, SODIUM BICARBONATE, TOCOPHERYL ACETATE, PANTHENOL, FRAGRANCE, PUNICA GRANATUM SEED OIL, COCOS NUCIFERA (COCONUT) OIL, OLEA EUROPAEA (OLIVE) FRUIT OIL, ARGANIA SPINOSA KERNEL OIL, SIMMONDSIA CHINENSIS (JOJOBA) SEED OIL, PERSEA GRATISSIMA (AVOCADO) OIL, ORBIGNYA OLEIFERA SEED OIL, MORINGA OLEIFERA SEED OIL, SALVIA HISPANICA SEED OIL, CRAMBE ABYSSINICA SEED OIL"
416,Makeup_remover,https://www.ewg.org/skindeep/products/837465-GRAYDON_Aloe_Milk_Cleanser_2019_formulation/,Graydon Aloe Milk Cleanser (2019 formulation),"Camellia Sinensis Leaf Extract, *Coco-Caprylate/Caprate, *Caprylic/Capric Triglyceride, *Glyceryl Stearate, *Coco-Caprylate, *Sodium Olivoyl Glutamate, *Cetearyl Alcohol, *Cetyl Alcohol, *Stearyl Alcohol, Prunus Armeniaca (Apricot) Kernel Oil, Niacinamide, Coco-Betaine, Glycerin, **Phenethyl Alcohol, **Pentylene Glycol, **Propanediol, *Lauryl Glucoside, *Polyglyceryl-2 Dipolyhydroxystearate, Aloe Barbadensis Leaf Juice, Dicaprylyl Carbonate, Tocopherol, Xanthan Gum, Sodium Stearoyl Glutamate, Citrus Paradisi (Grapefruit) Peel Oil, Citrus Aurantium Dulcis (Orange) Peel Oil, Pelargonium Graveolens Flower Oil, Limonene, Citronellol, Geraniol"
417,Makeup_remover,https://www.ewg.org/skindeep/products/922118-Topcare_Makeup_Remover_Cleansing_Cloths_Moisturizing_2020_formulation/,"Topcare Makeup Remover Cleansing Cloths, Moisturizing (2020 formulation)","WATER, GLYCERIN, ASPALATHUS LINEARIS LEAF EXTRACT, CAMELLIA SINENSIS LEAF EXTRACT, ILEX PARAGUARIENSIS LEAF EXTRACT, PANTHENOL, SODIUM BENZOATE, COCAMIDOPROPYL PG-DIMONIUM CHLORIDE PHOSPHATE, TOCOPHERYL ACETATE, GUAR HYDROXYPROPYLTRIMONIUM CHLORIDE, CETETH-2, CETEARETH-25, GLYCERYL STEARATE, OCTYLDODECANOL, DIMETHICONE, CETYL PALMITATE, ETHYLHEXYL PALMITATE, FRAGRANCE, CITRIC ACID."
418,Makeup_remover,https://www.ewg.org/skindeep/products/938024-Haus_Urban_Quick_Change_Micellar_Water_2020_formulation/,Haus Urban Quick Change Micellar Water (2020 formulation),"Aqua [Deionized Water], Hamamelis Virginiana [Witch Hazel] Water (and) Alcohol, Glycerin, Gluconolactone (and) Sodium Benzoate, Capric/Caprylic Triglycerides [MCT Oil], Lecithin, Decyl Glucoside, Essential Oil"
419,Makeup_remover,https://www.ewg.org/skindeep/products/806806-Honest_Beauty_Makeup_Remover_Wipes_2018_formulation/,Honest Beauty Makeup Remover Wipes (2018 formulation),"Water (Aqua), Polysorbate 20, Isopropyl Palmitate, Olea Europaea (Olive) Fruit Oil, Chamomilla Recutita (Matricaria) Flower Extract, Calendula Officinalis Flower Extract, Glycyrrhiza Glabra (Licorice) Root Extract, Cucumis Sativus (Cucumber) Fruit Extract, Glycerin, Aloe Barbadensis Leaf Juice Powder, Maltodextrin, Lavandula Hybrida Oil, Lavandula Angustifolia (Lavender) Oil, Abies Sibirica Oil, Pogostemon Cablin Leaf Oil, Cymbopogon Martini Oil, Pelargonium Graveolens Flower Oil, Anthemis Nobilis Flower Oil, Vitis Vinifera (Grape) Seed Oil, Citric Acid, Silver Citrate, Xylitol, Linalool, Geraniol."
420,Makeup_remover,https://www.ewg.org/skindeep/products/886242-Up__Up_Fragrance_Free_Makeup_Remover_Cleansing_Towelettes_2019_formulation/,Up & Up Fragrance Free Makeup Remover Cleansing Towelettes (2019 formulation),"WATER, ISOHEXADECANE, DICAPRYLYL ETHER, OCTYLDODECYL STEAROYL STEARATE, HEXYLENE GLYCOL, GLYCERIN, ETHYLHEXYL HYDROXYSTEARATE, LAURYL GLUCOSIDE, PROPYLENE GLYCOL, SORBITAN MONOLAURATE, POLYGLYCERYL-2 DIPOLYHYDROXYSTEARATE, CHAMOMILLA RECUTITA (MATRICARIA) FLOWER EXTRACT, CENTAUREA CYANUS FLOWER EXTRACT, CUCUMIS SATIVUS (CUCUMBER) FRUIT EXTRACT, CAMELLIA OLEIFERA LEAF EXTRACT, ALOE BARBADENSIS LEAF JUICE, ACRYLATES/C10-30 ALKYL ACRYLATE CROSSPOLYMER, TOCOPHERYL ACETATE, CITRIC ACID, DISODIUM EDTA, AMINOMETHYL PROPANOL, PHENOXYETHANOL, IODOPROPYNYL BUTYLCARBAMATE"
421,Makeup_remover,https://www.ewg.org/skindeep/products/1027920-TonyMoly_Tony_Moly_Peach_Punch_Cleansing_Water/,Tony Moly Peach Punch Cleansing Water,"Water, PEG-6 Caprylic/Apric Glycerides, Diproylene Glycol, Betaine, Prunus Persica(peach) Fruit Extract(10,000ppm), Butylene glycol, Glycerin, 1,2-Hexanediol, PEG-40 Hydrogenated Castor Oil, Allantion, disodium EDTA, Sodium Citrate, Citric Acid, Phenoxyethanol, Ethylhexylglycerin, Pafum"
422,Makeup_remover,https://www.ewg.org/skindeep/products/920883-Olay_Cleanse_Makeup_Remover_Wet_Cloths_Rose_Water_2020_formulation/,"Olay Cleanse Makeup Remover Wet Cloths, Rose Water (2020 formulation)","WATER, ETHYLHEXYL STEARATE, SORBITAN LAURATE, PROPYLENE GLYCOL, PHENOXYETHANOL, PEG-32 METHYL ETHER DIMETHICONE, GLYCERIN, POLYGLYCERYL-4 LAURATE, GOSSYPIUM HERBACEUM (COTTON) SEED OIL, GLYCERETH-18 ETHYLHEXANOATE, GLYCERETH-18, DMDM HYDANTION, DILAURYL CITRATE, FRAGRANCE, IODOPROPYNYL BUTYLCARBAMATE."
423,Makeup_remover,https://www.ewg.org/skindeep/products/920632-I_Dew_Care__I_Dew_Care_Berry_Melting_Melting_Makeup_Remover_Balm_2020_formulation/,I Dew Care Berry Melting Melting Makeup Remover Balm (2020 formulation),"Hydrogenated Poly(C6-14 Olefin), Cetyl Ethylhexanoate, Polyethylene, PEG-20 Glyceryl Triisostearate, PEG-8 Isostearate, Phenoxyethanol, Fragrance, Eclipta Prostrata Extract, Water, Melia Azadirachta Leaf Extract, Simmondsia Chinensis (Jojoba) Seed Oil, Water (Glacier Water), Octyldodecanol, Ethylhexylglycerin, Butylene Glycol, Melia Azadirachta Flower Extract, Coccinia Indica Fruit Extract, Lavandula Angustifolia (Lavender) Flower/Leaf/Stem Extract, Echium Plantagineum Seed Oil, Moringa Oleifera Seed Oil, Solanum Melongena (Eggplant) Fruit Extract, Aloe Barbadensis Flower Extract, 1,2-Hexanediol, Curcuma Longa (Turmeric) Root Extract, Ocimum Sanctum Leaf Extract, Corallina Officinalis Extract, Vaccinium Angustifolium (Blueberry) Fruit Extract, Cardiospermum Halicacabum Flower/Leaf/Vine Extract, Helianthus Annuus (Sunflower) Seed Oil Unsaponifiables, Tocopherol"
424,Makeup_remover,https://www.ewg.org/skindeep/products/936149-Studio_Selection_Makeup_Removing_Facial_Towelettes_2020_formulation/,Studio Selection Makeup Removing Facial Towelettes (2020 formulation),"WATER, GLYCERIN, SODIUM BENZOATE, COCAMIDOPROPYL PG-DIMONIUM CHLORIDE PHOSPHATE, TOCOPHERYL ACETATE, GUAR HYDROXYPROPYLTRIMONIUM CHLORIDE, CETETH-2, CETEARETH-25, GLYCERYL STEARATE, OCTYLDODECANOL, DIMETHICONE, CETYL PALMITATE, ETHYLHEXYL PALMITATE, FRAGRANCE, CITRIC ACID"
425,Makeup_remover,https://www.ewg.org/skindeep/products/3167186-Besame_Cosmetics_Cold_Cream_Cleanser__Makeup_Remover/,Besame Cosmetics Cold Cream Cleanser & Makeup Remover,"Water (Aqua), C12-15 Alkyl Benzoate, Isododecane, Glyceryl Stearate, Tridecyl Stearate, C15-19 Alkane, Helianthus Annuus (Sunflower) Seed Oil, Hydrogenated Farnesene, Cetearyl Alcohol, Neopentyl Glycol Dicaprylate/Dicaprate, Glycerin, Propanediol, Tridecyl Trimellitate, Butyrospermum Parkii (Shea) Butter, Phenoxyethanol, Polyacrylate Crosspolymer-6, Hydroxyacetophenone, Simmondsia Chinensis (Jojoba) Seed Oil, Tocopherol, Cetearyl Glucoside, Hydroxyethyl Acrylate/Sodium Acryloyl Dimethyl Taurate Copolymer, Cocos Nucifera (Coconut) Oil, Sorbitan Stearate, Tetrasodium Glutamate Diacetate, Acacia Catechu Gum, Panthenol, Polyglyceryl-4 Laurate/Succinate, Xanthan Gum, Ethylhexylglycerin, Rosa Canina (Dog Rose) Fruit Oil, Citric Acid, Chamomilla Recutita (Matricaria) Flower (Chamomile) Extract, Sodium Hyaluronate, Octyldodecanol, Calendula Officinalis (Marigold) Flower Extract, Beeswax, Rubus Idaeus (Raspberry) Juice, Yogurt Extract."
426,Makeup_remover,https://www.ewg.org/skindeep/products/925763-Nyakio_Cleansing_Oil_Balm_Sweet_Almond_2020_formulation/,"Nyakio Cleansing Oil Balm, Sweet Almond (2020 formulation)","CAPRYLIC/CAPRIC TRIGLYCERIDE, RICINUS COMMUNIS (CASTOR) SEED OIL, CAPRYLIC/CAPRIC/MYRISTIC/STEARIC TRIGLYCERIDE, EUPHORBIA CERIFERA (CANDELILLA) WAX, BUTYROSPERMUM PARKII (SHEA) BUTTER *+, PRUNUS AMYGDALUS DULCIS (SWEET ALMOND) OIL, HYDROGENATED CASTOR OIL, COFFEA ARABICA (COFFEE) SEED OIL, COCOS NUCIFERA (COCONUT) OIL, THEOBROMA CACAO (COCOA POD) POTASH, ELAEIS GUINEENSIS (PALM) KERNEL OIL, ADANSONIA DIGITATA (BAOBAB) SEED OIL, COPERNICIA CERIFERA (CARNAUBA) WAX, CERA ALBA (BEESWAX), TITANIUM DIOXIDE, IRON OXIDES (CI 77499), MICA, FRAGRANCE *CERTIFIED ORGANIC INGREDIENT +FAIR TRADE INGREDIENT"
427,Makeup_remover,https://www.ewg.org/skindeep/products/830781-Fountain_of_Truth_Take_It_Off_Cleansing_Balm__2019_formulation/,Fountain of Truth Take It Off Cleansing Balm  (2019 formulation),"Glycerin, Helianthus Annuus (Sunflower) Seed Oil*, Cocos Nucifera (Coconut) Oil*, Helianthus Annuus (Sunflower) Seed Wax*, Sucrose Stearate, Argania Spinosa Kernel Oil*, Citrus Aurantifolia (Lime) Oil, Citrus Aurantium Bergamia (Bergamot) Fruit Oil, Citrus Aurantium Dulcis (Orange) Peel Oil, Citrus Limon (Lemon) Peel Oil, Copernicia Cerifera (Carnauba) Wax, Eugenia Caryophyllus (Clove) Leaf Oil, Rosmarinus Officinalis (Rosemary) Leaf Oil, Salvia Sclarea (Clary) Oil, Vitis Vinifera (Grape) Seed Oil*, Citrus Aurantium Dulcis (Orange) Fruit Extract, Citrus Limon (Lemon) Fruit Extract, Curcuma Longa (Turmeric) Root Powder*, Leuconostoc/Radish Root Ferment Filtrate, Saccharomyces/ Copper Ferment, Saccharomyces/Iron Ferment, Saccharomyces/Magnesium Ferment, Saccharomyces/Silicon Ferment, Saccharomyces/Zinc Ferment, Undaria Pinnatifida Cell Culture Extract, Tocopheryl Acetate, Water (Aqua), Caprylic/Capric Triglyceride, Limonene, Linalool."
428,Makeup_remover,https://www.ewg.org/skindeep/products/963651-Rodan_and_Fields_Rodan__Fields_Essentials_Complete_Eye_Makeup_Remover/,Rodan + Fields Essentials Complete Eye Makeup Remover,"Water/Aqua/Eau, Cyclopentasiloxane, Glycerin, Isododecane, Pentylene Glycol, Butylene Glycol, Polyglyceryl-4 Caprate, Polyglyceryl-3 Cocoate, Polyglyceryl-6 Caprylate, Polyglyceryl-6 Ricinoleate, Panthenol, Bisabolol, Trehalose, Biotin, Disodium Phosphate, Sodium Chloride, Sodium Phosphate, Alcohol Denat., Benzalkonium Chloride."
429,Makeup_remover,https://www.ewg.org/skindeep/products/1042318-Sephora_Collection_Clean_Cleansing__Gentle_Exfoliating_Wipes_Watermelon/,"Sephora Collection Clean Cleansing & Gentle Exfoliating Wipes, Watermelon","Aqua (Water), Glycerin, Polyglyceryl-10 Laurate, Diglycerin, Coco-Glucoside, Butylene Glycol, Levulinic Acid, Sodium Benzoate, Parfum (Fragrance), Sodium Levulinate, Citrullus Lanatus (Watermelon) Fruit Extract, Aloe Barbadensis Leaf Juice Powder"
430,Makeup_remover,https://www.ewg.org/skindeep/products/998072-Simple_Truth_Facial_Wipes_Face_Coconut_Water/,"Simple Truth Facial Wipes Face, Coconut Water","WATER, GLYCERIN, COCOS NUCIFERA (COCONUT) LIQIUID ENDOSPERM, COCOS NUCIFERA (COCONUT) FRUIT JUICE, COCO GLUCOSIDE, DECYL GLYCOSIDE, POLYGLTCERYL-6 CAPRYLATE, POLYGLTCERYL-4 CAPRYLATE, POLYGLTCERYL-10 CAPRYLATE/CAPRATE, ALOE BARBADENSIS LEAF JUICE, GLYCERYL OLEATE, PHYTIC ACID, SODUM CIRATE, PHENOXTHANOL, ETHYLHEXYGLYCERIN, FRAGRANCE"
431,Makeup_remover,https://www.ewg.org/skindeep/products/961330-Beauty_360_Cleansing_Makeup_Remover_Towelettes/,Beauty 360 Cleansing Makeup Remover Towelettes,"WATER, DICAPRYLYL ETHER, DECYL GLUCOSIDE, GLYCERYL OLEATE, CHAMOMILLA, RECUTITA (MATRICARIA) FLOWER EXTRACT, GLYCERIN, CAMELLIA SINENSIS LEAF EXTRACT, ASPALATHUS LINEARIS LEAF EXTRACT, BUTYLENE GLYCOL, TOCOPHERYL ACETATE, PANTHENOL, SODIUM BICARBONATE, TETRA SODIUM GLUTAMATE DIACETATE, CITRIC ACID, SODIUM CITRATE, FRAGRANCE, PHENOXYETHANOL, BENZOIC ACID, DEHYDROACETIC ACID"
432,Makeup_remover,https://www.ewg.org/skindeep/products/867667-Garnier_SkinActive_Allin1_Waterproof_Micellar_Makeup_Removing_Towelettes_2019_formulation/,Garnier SkinActive All-in-1 Waterproof Micellar Makeup Removing Towelettes (2019 formulation),"942066 3 WATER, ISOHEXADECANE, DICAPRYLYL ETHER, HEXYLENE GLYCOL, ACRYLATES/C10-30 ALKYL ACRYLATE CROSSPOLYMER, AMINOMETHYL PROPANOL, CITRIC ACID, GLYCERIN, IODOPROPYNYL BUTYLCARBAMATE, LAURYL GLUCOSIDE, PHENOXYETHANOL, POLYGLYCERYL-2 DIPOLYHYDROXYSTEARATE, PROPYLENE GLYCOL, SORBITAN LAURATE, TETRASODIUM GLUTAMATE DIACETATE, TOCOPHEROL, TOCOPHERYL ACETATE"
433,Makeup_remover,https://www.ewg.org/skindeep/products/968735-Nudestix_Citrus_Clean_Balm__Make_Up_Melt/,Nudestix Citrus Clean Balm & Make Up Melt,"ISODECYL NEOPENTANOATE, ISONONYL ISONONANOATE, PEG-10 ISOSTEARATE, PEG-20 GLYCERYL TRIISOSTEARATE, SILICA DIMETHYL SILYLATE, SYNTHETIC WAX, TRIHYDROXYSTEARIN, SORBITAN OLIVATE, LITSEA CUBEBA FRUIT OIL, CITRUS AURANTIUM DULCIS (ORANGE) PEEL OIL, LAVANDULA ANGUSTIFOLIA (LAVENDER) OIL, PELARGONIUM GRAVEOLENS OIL, DEHYDROACETIC ACID, CANARIUM LUZONICUM GUM NONVOLATILES, ROSMARINUS OFFICINALIS (ROSEMARY) LEAF OIL, EUCALYPTUS GLOBULUS LEAF OIL, ANTHEMIS NOBILIS FLOWER OIL, CITRUS AURANTIUM AMARA (BITTER ORANGE) FLOWER OIL, ACACIA SENEGAL GUM, CURCUMA LONGA (TURMERIC) ROOT EXTRACT, MALTODEXTRIN, WATER (AQUA), ROSA CANINA FRUIT OIL, BUTYLENE GLYCOL, SALVIA HISPANICA SEED EXTRACT, PYRUS MALUS (APPLE) FRUIT EXTRACT, *CITRAL, *LIMONENE, *LINALOOL, *CITRONELLOL, *GERANIOL"
434,Makeup_remover,https://www.ewg.org/skindeep/products/1042321-Sephora_Collection_Clean_Cleansing__Gentle_Exfoliating_Wipes_Hemp/,"Sephora Collection Clean Cleansing & Gentle Exfoliating Wipes, Hemp","Aqua (Water), Glycerin, Polyglyceryl-10 Laurate, Diglycerin, Coco-Glucoside, Butylene Glycol, Levulinic Acid, Sodium Benzoate, Parfum (Fragrance), Sodium Levulinate, Aloe Barbadensis Leaf Juice Powder, Cannabis Sativa Seed Oil"
435,Makeup_remover,https://www.ewg.org/skindeep/products/4551689-Benefit_Cosmetics_The_POREfessional_Womens_Get_Unblocked_MakeupRemoving_Cleansing_Oil__15oz__Ulta_Beauty/,Benefit Cosmetics The POREfessional Women's Get Unblocked Makeup-Removing Cleansing Oil - 1.5oz - Ulta Beauty,"CAPRYLIC/CAPRIC TRIGLYCERIDE, SIMMONDSIA CHINESIS (JOJOBA) SEED OIL, PEG-40 SORBITAN PEROLEATE, PERSEA GRATISSIMA (AVOCADO) OIL, VITIS VINIFERA (GRAPE) SEED OIL, 1,2-HEXANEDIOL, CAPRYLYL GLYCOL, PARFUM (FRAGRANCE), BISABOLOL, PRUNUS DOMESTICA SEED OIL, TRIETHYL CITRATE, TOCOPHEROL, CERAMIDE NP, TOCOPHERYL ACETATE, PENTAERYTHRITYL TETRA-DI-T-BUTYL HYDROXYHYDROCINNAMATE."
436,Makeup_remover,https://www.ewg.org/skindeep/products/1013467-elf_Holy_Hydration_Makeup_Melting_Cleansing_Balm/,e.l.f. Holy Hydration! Makeup Melting Cleansing Balm,"CETYL ETHYLHEXANOATE, CAPRYLIC/CAPRIC TRIGLYCERIDE, HYDROGENATED POLYDECENE, PEG-20 GLYCERYL TRIISOSTEARATE, POLYETHYLENE, PEG-10 ISOSTEARATE, HELIANTHUS ANNUUS (SUNFLOWER) SEED OIL, HYDROGENATED SUNFLOWER SEED OIL, PALMITOYL TRIPEPTIDE-1, PALMITOYL TETRAPEPTIDE-7, CERAMIDE 3, CERAMIDE 6 II, CERAMIDE 1, HYDROLYZED SODIUM HYALURONATE, PHYTOSPHINGOSINE, GLYCERIN, BUTYLENE GLYCOL, WATER (AQUA), POLYSORBATE 20, CARBOMER, XANTHAN GUM, CHOLESTEROL, SODIUM LAUROYL LACTYLATE, PHENOXYETHANOL, ETHYLHEXYLGLYCERIN, CAPRYLYL GLYCOL, GERANIOL, LINALOOL, FRAGRANCE (PARFUM)"
437,Makeup_remover,https://www.ewg.org/skindeep/products/930434-Giovanni_Dtox_System_Facial_Cleansing_Towelettes_Purifying__Exfoliating_2020_formulation/,"Giovanni D:tox System Facial Cleansing Towelettes, Purifying & Exfoliating (2020 formulation)","AQUA (PURIFIED WATER), POLYSORBATE 20, CELLULOSE GUM, COCAMIDOPROPYL BETAINE, TOCOPHERYL ACETATE (VITAMIN E ACETATE), COCO-GLUCOSIDE, VOLCANIC ASH, *EUTERPE OLERACEA (ACAI BERRY) FRUIT EXTRACT, *LYCIUM BARBARUM (GOJI BERRY) FRUIT EXTRACT, *FICUS CARICA (FIG) FRUIT EXTRACT, *CAMELLIA SINENSIS (GREEN TEA) LEAF EXTRACT, PHENOXYETHANOL, CAPRYLYL GLYCOL, NATURAL FRAGRANCE"
438,Makeup_remover,https://www.ewg.org/skindeep/products/1993103-Guerlain_Beaut_Des_Yeux_BIPHASE_EYE_MAKE_UP_REMOVER/,"Guerlain Beauté Des Yeux, BIPHASE EYE MAKE UP REMOVER","AQUA (WATER), CYCLOPENTASILOXANE, HYDROGENATED POLYISOBUTENE, BUTYLENE GLYCOL, PHENOXYETHANOL, POLOXAMER 184, SODIUM TRIDECETH SULFATE, SODIUM LAUROAMPHOACETATE, DIPOTASSIUM GLYCYRRHIZATE, HEXYLENE GLYCOL, SODIUM CITRATE, SODIUM CHLORIDE, ARTEMIA EXTRACT, ISOPROPYL ALCOHOL, CITRIC ACID, POTASSIUM SORBATE, NIGELLA SATIVA SEED OIL, SCUTELLARIA BAICALENSIS ROOT EXTRACT, CI 42090 (BLUE 1)"
439,Makeup_remover,https://www.ewg.org/skindeep/products/789791-Mustela_Cleansing_Wipes_old_formulation/,Mustela Cleansing Wipes (old formulation),"AQUA /WATER/EAU, GLYCERIN, PEG-40 HYDROGENATED CASTOR OIL, SODIUM BENZOATE, POTASSIUM SORBATE, ALLANTOIN, 1,2-HEXANEDIOL, CAPRYLYL GLYCOL, TARTARIC ACID, PROPYLENE GLYCOL, ALOE BARBADENSIS LEAF JUICE POWDER, SAPONARIA OFFICINALIS LEAF/ROOT EXTRACT, TROPOLONE, PERSEA GRATISSIMA (AVOCADO) FRUIT EXTRACT, SODIUM HYDROXIDE, PARFUM (FRAGRANCE)"
440,Makeup_remover,https://www.ewg.org/skindeep/products/9359722-Equate_Makeup_Remover_Cleansing_Towelette_Wipes_for_Face_Care_Fragrance_Free__Alcohol_Free_40_Count_Compare_to_Neutrogena_Makeup_Remover_Cleansing_towelettes_Fragrance_Free/,"Equate Makeup Remover Cleansing Towelette Wipes for Face Care, Fragrance Free & Alcohol Free (40 Count), Compare to Neutrogena Makeup Remover Cleansing towelettes Fragrance Free","Water, Hydrogenated Farnesene, Sorbitan Laurate, Lactic Acid, Tetrasodium Glutamate Diacetate, Phenoxyethanol, Benzoic Acid, Dehydroacetic Acid, Butyrospermum Parkii (Shea) Butter Extract, Magnesium Ascorbyl Phosphate, Glycerin, Lauryl Glucoside, Polyglyceryl-2 Dipolyhydroxystearate, Tocopheryl Acetate, Acrylates/Vinyl Isodecanoate Crosspolymer, Punica Granatum Seed Oil, Cocos Nucifera (Coconut) Oil, Olea Europaea (Olive) Fruit Oil, Argania Spinosa Kernel Oil, Simmondsia Chinensis (Jojoba) Seed Oil, Persea Gratissima (Avocado) Oil, Orbignya Oleifera Seed Oil, Moringa Oleifera Seed Oil, Salvia Hispanica Seed Oil, Crambe Abyssinica Seed Oil, Chamomilla Recutita (Matricaria) Flower Extract, Aloe Barbadensis Leaf Juice, Aminomethyl Propanol"
441,Makeup_remover,https://www.ewg.org/skindeep/products/838022-Brandless_Facial_Wipes_White_Tea_2019_formulation/,"Brandless Facial Wipes, White Tea (2019 formulation)","Water, Triethyl Citrate, Sorbitan Oleate Decylglucoside Crosspolymer, Aloe Barbadensis (Aloe Vera) Leaf Extract, Avena Sativa (Oat) Kernel Flour, Ananas Sativus (Pineapple) Fruit Extract, Oenothera Biennis (Evening Primrose) Oil, Chamomilla Recutita (Matricaria) Flower Extract, Prunus Amygdalus Dulcis (Sweet Almond) Oil, Sea Salt, Helianthus Annuus (Sunflower) Seed Oil, Saccharum Officinarum (Sugarcane) Extract, Calendula Officinalis (Marigold) Flower Extract, Glycerin, Potassium Sorbate, Phenoxyethanol, Fragrance."
442,Makeup_remover,https://www.ewg.org/skindeep/products/945882-POP_Arazzi_Detoxifying_Makeup_Remover_Pre_Moistened_Facial_Wipes_Citrus_2020_formulation/,"Pop Arazzi Detoxifying Makeup Remover Pre Moistened Facial Wipes, Citrus (2020 formulation)","WATER, DICAPRYLYL ETHER, DECYL GLUCOSIDE, GLYCERYL OLEATE, MENTHA PIPERITA (PEPPERMINT) LEAF EXTRACT, VITIS VINIFERA (GRAPE) FRUIT EXTRACT, GLYCERIN, TOCOPHERYL ACETATE, PANTHENOL, SODIUM BICARBONATE, TETRASODIUM GLUTAMATE DIACETATE, CITRIC ACID, SODIUM CITRATE, FRAGRANCE, PHENOXYETHANOL, BENZOIC ACID, DEHYDROACETIC ACID."
443,Makeup_remover,https://www.ewg.org/skindeep/products/1044779-P_Louise_P_Louise_Make_It_Melt_Makeup_Remover_/,P .Louise Make It Melt Makeup Remover,"Ethylhexyl Palmitate,Peg-20 Glyceryl Triisostearate,Cetyl Ethylhexanoate,Cocos Nucifera (Coconut) Fruit Oil,Polyethylene,Phenoxyethanol,Tocopheryl Acetate,. Simmondsia Chinensis (Jojoba) Seed Oil,Helianthus Annuus (Sunflower) Seed Oil,Macadamia Ternifolia Seed Oil,Hydrogenated Olive Oil,Camellia Japonica Seed Oil, Parfum,Water,Butylene Glycol,Bakumondou Ekisu,Tropaeolum?Majus?Extract,Prunus Speciosa Flower Extract,Hydroxyacetophenone"
444,Makeup_remover,https://www.ewg.org/skindeep/products/636189-SISLEY_TripleOil_Balm_MakeUp_Remover_and_Cleanser/,Sisley Triple-Oil Balm Make-Up Remover and Cleanser,"BUTYROSPERMUM PARKII (SHEA) BUTTER, HYDROGENATED POLYISOBUTENE, ORBIGNYA OLEIFERA SEED OIL, PEG-20 GLYCERYL TRIISOSTEARATE, HYDROGENATED VEGETABLE OIL, CETYL ALCOHOL, MACADAMIA INTEGRIFOLIA SEED OIL, MANGIFERA INDICA (MANGO) SEED BUTTER, HELIANTHUS ANNUUS (SUNFLOWER) SEED WAX, BISABOLOL, PARFUM/FRAGRANCE, GLYCINE SOJA (SOYBEAN) OIL, DEHYDROACETIC ACID, TOCOPHEROL, ASCORBYL PALMITATE."
445,Makeup_remover,https://www.ewg.org/skindeep/products/1042317-Sephora_Collection_Clean_Cleansing__Gentle_Exfoliating_Wipes_Charcoal/,"Sephora Collection Clean Cleansing & Gentle Exfoliating Wipes, Charcoal","Aqua (Water), Glycerin, Polyglyceryl-10 Laurate, Diglycerin, Coco-Glucoside, Butylene Glycol, Levulinic Acid, Sodium Benzoate, Sodium Levulinate, Ceratonia Siliqua (Carob) Gum, Xanthan Gum, Parfum (Fragrance), Aloe Barbadensis Leaf Juice Powder, Charcoal Powder"
446,Makeup_remover,https://www.ewg.org/skindeep/products/961320-Clarins_Total_Cleansing_Oil/,Clarins Total Cleansing Oil,"HELIANTHUS ANNUUS (SUNFLOWER) SEED OIL, C9-12 ALKANE, PEG-20 GLYCERYL TRIISOSTEARATE, PRUNUS ARMENIACA (APRICOT) KERNEL OIL, AQUA/WATER/EAU, PROPANEDIOL, PARFUM/ FRAGRANCE, TOCOPHEROL, MELISSA OFFICINALIS LEAF EXTRACT*, SODIUM CITRATE, GENTIANA LUTEA EXTRACT*, CITRIC ACID, CAPSICUM ANNUUM FRUIT EXTRACT, MALTODEXTRIN, MORINGA OLEIFERA SEED EXTRACT, ROSMARINUS OFFICINALIS (ROSEMARY) LEAF EXTRACT."
